{
  "id": "pets",
  "title": "반려동물",
  "holland": [
    "R",
    "S"
  ],
  "summary": "개, 고양이 같은 반려동물을 돌보고, 가르치고, 치료를 돕는 일이에요. 봉사, 특성화고, 직업훈련으로 대학 없이 시작할 수 있는 길이 있고, 동물보건사는 전문대 이상, 수의사는 수의대 6년이 꼭 필요해요. 귀여움만이 아니라 냄새, 힘쓰는 일, 아픈 동물도 만나는 일이에요.",
  "try_phrase": "동물 돌보기",
  "paths": [
    {
      "id": "pets-volunteer-path",
      "title": "봉사로 시작해서 반려동물행동지도사로",
      "learn_style": "hands",
      "summary": "보호센터를 찾아 봉사를 해 보고, 만 18세가 되면 반려동물행동지도사 2급 시험을 봐서 훈련·교육 쪽 일을 해요.",
      "steps": [
        {
          "step": "pets-mission-find-shelter"
        },
        {
          "step": "pets-shelter-volunteer",
          "note": "봉사하면서 여러 동물의 행동을 가까이 봐요."
        },
        {
          "step": "pets-behavior-exam",
          "note": "1차 원서접수 마감일에 만 18세 이상이어야 해요."
        },
        {
          "step": "pets-work"
        }
      ],
      "pros": [
        "봉사로 먼저 해 볼 수 있어요.",
        "학교에 다니지 않아도 시험을 볼 수 있어요.",
        "국가자격이라 합격한 사람만 '반려동물행동지도사'라는 이름을 쓸 수 있어요."
      ],
      "cons": [
        "만 18세가 되기 전에는 시험을 볼 수 없어요.",
        "실기 시험에 내 개나 부모님의 개가 있어야 해요.",
        "청소년을 받는 동물 봉사 자리가 많지 않아요.",
        "2024년에 처음 생긴 자격이라 일자리가 얼마나 되는지 아직 자료가 적어요."
      ]
    },
    {
      "id": "pets-training-path",
      "title": "직업훈련으로 반려동물 미용·관리 배우기",
      "learn_style": "institution",
      "summary": "훈련기관에서 반려동물 미용이나 관리 실기를 배우고, 미용실이나 위탁관리 가게에서 일을 시작해요.",
      "steps": [
        {
          "step": "pets-mission-find-shelter"
        },
        {
          "step": "pets-training-course"
        },
        {
          "step": "pets-work"
        }
      ],
      "pros": [
        "실기를 순서대로 배워요.",
        "조건이 맞으면 훈련비를 지원받을 수 있어요.",
        "대학 없이 갈 수 있어요."
      ],
      "cons": [
        "반려동물 미용은 국가자격이 없어서, 민간자격마다 기준이 달라요.",
        "지원을 받아도 본인부담금이 꽤 드는 과정이 있어요.",
        "동물이 물거나 할퀼 수 있고 서서 힘쓰는 일이 많아요."
      ]
    },
    {
      "id": "pets-hs-path",
      "title": "특성화고 반려동물 학과에서 배우기",
      "learn_style": "school",
      "summary": "반려동물 학과가 있는 특성화고에 다니며 배우고, 졸업한 뒤 일을 하거나 반려동물행동지도사 시험, 동물보건 전문대로 이어 가요.",
      "steps": [
        {
          "step": "pets-mission-find-shelter"
        },
        {
          "step": "pets-vocational-hs"
        },
        {
          "step": "pets-behavior-exam",
          "note": "1차 원서접수 마감일에 만 18세 이상이어야 해요."
        },
        {
          "step": "pets-work"
        }
      ],
      "pros": [
        "고등학교를 다니면서 반려동물을 배워요.",
        "졸업하면 고졸 학력이 생겨서 동물보건 전문대에도 지원할 수 있어요."
      ],
      "cons": [
        "반려동물 학과가 있는 학교가 가까이에 없을 수 있어요.",
        "배우는 내용은 학교마다 달라요.",
        "학교를 그만뒀다면 다시 들어갈 수 있는지 학교에 물어봐야 해요."
      ]
    },
    {
      "id": "pets-vet-nurse-path",
      "title": "검정고시 보고 동물보건사로",
      "learn_style": "study",
      "summary": "학력을 인정받고 전문대 이상 동물보건 관련 학과를 졸업한 뒤, 동물보건사 시험을 봐서 동물병원에서 일해요.",
      "steps": [
        {
          "step": "ged-high"
        },
        {
          "step": "pets-animal-health-college",
          "note": "평가인증을 받은 학과인지 꼭 확인해요."
        },
        {
          "step": "pets-animal-health-exam"
        },
        {
          "step": "pets-work",
          "note": "동물병원에서 수의사를 도와 동물을 간호해요."
        }
      ],
      "pros": [
        "국가자격이라 동물병원에서 할 수 있는 일이 법으로 정해져 있어요.",
        "시험이 필기로만 있어요."
      ],
      "cons": [
        "대학(전문대 이상)을 다녀야 해서 시간과 학비가 들어요.",
        "동물을 치료하는 것은 수의사만 할 수 있어요. 동물보건사는 돕는 역할이에요.",
        "아프거나 죽는 동물을 자주 만나요."
      ]
    },
    {
      "id": "pets-vet-path",
      "title": "검정고시 보고 수의대로",
      "learn_style": "study",
      "summary": "학력을 인정받고 수의과대학 6년을 다닌 뒤 국가시험에 합격해 수의사가 돼요.",
      "steps": [
        {
          "step": "ged-high"
        },
        {
          "step": "pets-vet-school"
        },
        {
          "step": "pets-work"
        }
      ],
      "pros": [
        "동물을 진료할 수 있는 건 수의사뿐이에요.",
        "개인이 동물병원을 열 수 있는 건 수의사뿐이에요."
      ],
      "cons": [
        "수의대 6년에 입시까지 시간이 가장 오래 걸려요.",
        "학비가 많이 들어요.",
        "대학 없이 갈 방법은 없어요."
      ]
    }
  ]
}
