{
  "id": "office-finance",
  "title": "사무·회계",
  "holland": [
    "C",
    "E"
  ],
  "summary": "서류와 숫자를 정리하고 계산해서 회사나 기관의 일이 잘 돌아가게 돕는 일이에요. 나이·학력 제한이 없는 자격증과 일한 경험으로 시작하는 경우가 많아요. 학교를 그만뒀어도 자격증이나 9급 공무원 시험으로 갈 수 있어요.",
  "try_phrase": "엑셀로 표 만들기",
  "paths": [
    {
      "id": "office-finance-parttime-path",
      "title": "사무 보조로 일하며 자격증 따기",
      "learn_style": "hands",
      "summary": "한 번 표로 정리해 보고, 사무 보조로 일하며 회사 일을 익히고, 자격증을 따서 사무·회계 일을 시작해요.",
      "steps": [
        {
          "step": "office-finance-mission-pocket-money"
        },
        {
          "step": "office-finance-office-assistant"
        },
        {
          "step": "office-finance-computer-license",
          "note": "일하면서 따로 시간을 내서 준비해요."
        },
        {
          "step": "office-finance-accounting-license"
        },
        {
          "step": "office-finance-office-job"
        }
      ],
      "pros": [
        "일하면서 돈을 벌고 회사 일을 바로 봐요.",
        "학교나 학원에 다니지 않아도 시작할 수 있어요."
      ],
      "cons": [
        "사무 보조 자리마다 맡기는 일이 달라서, 배울 수 있는 정도도 곳마다 달라요.",
        "만 18세 미만은 일할 수 있는 시간과 조건에 제한이 있어요. 근로계약서를 꼭 받아요.",
        "자격증 공부는 일과 별도로 시간을 내야 해요."
      ]
    },
    {
      "id": "office-finance-training-path",
      "title": "직업훈련으로 회계부터",
      "learn_style": "institution",
      "summary": "훈련기관에서 회계 프로그램과 사무 프로그램을 배우고 자격증을 딴 뒤 일을 시작해요.",
      "steps": [
        {
          "step": "office-finance-training-course"
        },
        {
          "step": "office-finance-computer-license"
        },
        {
          "step": "office-finance-accounting-license"
        },
        {
          "step": "office-finance-office-job"
        }
      ],
      "pros": [
        "자격증 시험에 맞춰 순서대로 배워요.",
        "조건이 맞으면 훈련비를 지원받을 수 있어요."
      ],
      "cons": [
        "지원을 받아도 내가 내는 돈이 있을 수 있어요.",
        "경력을 원하는 공고도 있어서 자격증만으로는 부족할 수 있어요.",
        "과정마다 내용과 질이 달라서 미리 비교해 봐야 해요."
      ]
    },
    {
      "id": "office-finance-hs-path",
      "title": "특성화고 회계·사무과에서 배우기",
      "learn_style": "school",
      "summary": "회계·세무·사무 학과가 있는 특성화고에서 친구들과 배우며 자격증을 따고 일을 시작해요.",
      "steps": [
        {
          "step": "office-finance-vocational-hs"
        },
        {
          "step": "office-finance-computer-license"
        },
        {
          "step": "office-finance-accounting-license"
        },
        {
          "step": "office-finance-office-job",
          "note": "학과 성적이 좋고 학교장 추천을 받은 고등학교 졸업(예정)자가 보는 지역인재 9급 수습직원 선발시험도 있어요. 어떤 학교·학과가 추천 대상인지는 해마다 인사혁신처 공고로 확인해요."
        }
      ],
      "pros": [
        "친구들과 함께 배우고 자격증을 학교에서 준비해요.",
        "졸업할 때 학교를 통해 취업이나 추천 채용을 알아볼 수 있어요."
      ],
      "cons": [
        "학교를 그만뒀다면 다시 들어갈 수 있는지부터 확인해야 해요.",
        "학과가 있는 학교가 지역마다 달라요."
      ]
    },
    {
      "id": "office-finance-civil-path",
      "title": "9급 공무원 시험 보기",
      "learn_style": "study",
      "summary": "학력 제한 없는 9급 공무원 공개채용 시험을 준비해서 나라나 지방자치단체에서 일해요.",
      "steps": [
        {
          "step": "office-finance-mission-pocket-money"
        },
        {
          "step": "office-finance-civil-exam",
          "note": "시험을 보는 해에 만 18세 이상이어야 해요."
        },
        {
          "step": "office-finance-civil-servant"
        }
      ],
      "pros": [
        "국가공무원 시험은 학력과 상관없이 시험 성적으로 뽑아요.",
        "검정고시 없이도 응시할 수 있어요."
      ],
      "cons": [
        "준비 기간이 길어질 수 있고, 떨어지면 따로 남는 경력이 없어요.",
        "혼자 오래 공부해야 해서 버티기 힘들 수 있어요.",
        "합격해도 바로 일을 시작하지 못하고 기다릴 수 있어요."
      ]
    }
  ]
}
