{
  "id": "writing",
  "title": "글쓰기·기획",
  "holland": [
    "A",
    "I"
  ],
  "summary": "이야기를 짓거나 정보를 모아 글로 전하는 일이에요. 오늘 바로 써서 올려 볼 수 있지만, 글로 버는 돈은 일정하지 않아요. 학력 없이 시작할 수 있는 길과 대학을 거치는 길이 함께 있어요.",
  "try_phrase": "글 써서 올리기",
  "paths": [
    {
      "id": "writing-online-path",
      "title": "직접 쓰고 올리며 독자 만나기",
      "learn_style": "hands",
      "summary": "짧은 글부터 써서 블로그나 웹소설 플랫폼에 올리고, 공모전에 내 보며 실력을 키워요. 조건이 맞으면 연재나 외주로 수입을 만들어 봐요.",
      "steps": [
        { "step": "writing-mission-one-piece" },
        { "step": "writing-post-online" },
        { "step": "writing-contest" },
        { "step": "writing-freelance", "note": "만 19세 미만이면 부모 동의부터 받아요." }
      ],
      "pros": [
        "돈 없이 오늘 바로 시작할 수 있어요.",
        "독자 반응을 바로 볼 수 있어요.",
        "소설가는 특별히 요구되는 학력 조건이 없어요."
      ],
      "cons": [
        "글로 버는 돈은 일정하지 않고 거의 없을 수도 있어요.",
        "만 19세 미만은 계약을 맺을 때 부모 동의가 필요해요.",
        "악성 댓글이나 개인정보 노출에 조심해야 해요.",
        "혼자 하다 보면 꾸준히 쓰기가 어려워요."
      ]
    },
    {
      "id": "writing-broadcast-path",
      "title": "방송작가 교육원 거쳐 막내 작가로",
      "learn_style": "institution",
      "summary": "쓰는 습관을 들이고 공모전으로 작품을 모은 뒤, 만 19세가 되면 방송작가 교육원에서 대본 쓰는 법을 배워 막내 작가로 일을 시작해요.",
      "steps": [
        { "step": "writing-mission-one-piece" },
        { "step": "writing-contest", "note": "교육원 지원 나이가 되기 전에 쓴 글을 모아 둬요." },
        { "step": "writing-broadcast-academy" },
        { "step": "writing-broadcast-junior" }
      ],
      "pros": [
        "방송 대본 쓰는 법을 순서대로 배워요.",
        "교육원 드라마 기초반은 학력 제한 없이 지원할 수 있어요."
      ],
      "cons": [
        "알아본 교육원은 만 19세부터 지원할 수 있어요.",
        "전형료와 등록금이 들고, 지원해도 떨어질 수 있어요.",
        "교육원이 서울에 있어서 다른 지역에서는 다니기 어려울 수 있어요.",
        "막내 작가 자리는 나이와 경력을 보고, 계약 조건이 곳마다 달라요."
      ]
    },
    {
      "id": "writing-college-path",
      "title": "검정고시 보고 대학 글쓰기·미디어 학과로",
      "learn_style": "study",
      "summary": "학력을 인정받고, 쓴 글을 모으며 대학에서 문예창작·국문·미디어를 배운 뒤 기자, 편집자, 콘텐츠 기획자 채용에 도전해요.",
      "steps": [
        { "step": "ged-high", "note": "학교에 다니고 있다면 건너뛰어요." },
        { "step": "writing-post-online", "note": "입시나 채용 때 보여 줄 글을 모아요." },
        { "step": "writing-college" },
        { "step": "writing-media-job" }
      ],
      "pros": [
        "글쓰기와 매체를 넓게 배우고 함께 쓰는 사람을 만나요.",
        "기자처럼 대학을 나온 사람이 많은 일을 준비하기 좋아요."
      ],
      "cons": [
        "검정고시와 입시를 거쳐서 시간이 오래 걸려요.",
        "학비가 들어요.",
        "졸업해도 언론사 채용 시험은 경쟁이 세요."
      ]
    }
  ]
}
