{
  "id": "sports",
  "title": "운동·스포츠",
  "holland": [
    "R",
    "S"
  ],
  "summary": "운동을 직접 하거나 다른 사람에게 가르치는 일이에요. 학력 조건 없이 만 18세부터 볼 수 있는 체육지도자 국가 자격이 있어서, 학교를 그만뒀어도 갈 수 있는 길이 있어요. 선수가 되는 길은 좁아서, 가르치는 길과 함께 보는 게 좋아요.",
  "try_phrase": "운동이나 스포츠",
  "paths": [
    {
      "id": "sports-center-path",
      "title": "체육시설 현장을 보며 지도사 준비",
      "learn_style": "institution",
      "summary": "한 번 가르쳐 보고, 체육 행사나 스포츠센터에서 일손을 도우며 현장을 본 뒤, 2급 생활스포츠지도사를 따서 운동을 가르쳐요.",
      "steps": [
        {
          "step": "sports-mission-teach-one"
        },
        {
          "step": "sports-field-helper",
          "note": "만 18세 전에는 봉사나 짧은 아르바이트로 현장을 봐요."
        },
        {
          "step": "sports-life-coach-exam",
          "note": "만 18세가 되면 볼 수 있어요. 첫 시험 접수 마감일 기준으로 나이를 따져요."
        },
        {
          "step": "sports-coach-work"
        }
      ],
      "pros": [
        "대학이나 학원을 거치지 않아도 국가 자격을 딸 수 있어요.",
        "현장을 먼저 보고 어떤 종목·시설이 맞는지 고를 수 있어요."
      ],
      "cons": [
        "만 18세 전에는 자격을 딸 수 없어서 기다리는 시간이 있어요.",
        "시험이 보통 1년에 한 번이라 한 번 떨어지면 오래 기다려요.",
        "연수 90시간을 따로 내야 하고, 응시료와 연수비로 27만 원쯤 들어요."
      ]
    },
    {
      "id": "sports-kids-path",
      "title": "아이들 체육 가르치는 지도사",
      "learn_style": "study",
      "summary": "아이들에게 운동을 가르치는 유소년스포츠지도사를 차근차근 공부해서 따고, 같은 종목의 생활스포츠지도사로 넓혀요.",
      "steps": [
        {
          "step": "sports-mission-teach-one",
          "note": "동생이나 어린 친척에게 가르쳐 보면 더 좋아요."
        },
        {
          "step": "sports-youth-coach-exam"
        },
        {
          "step": "sports-life-coach-exam",
          "note": "유소년 자격이 있으면 같은 종목은 구술시험과 40시간 연수로 딸 수 있어요."
        },
        {
          "step": "sports-coach-work"
        }
      ],
      "pros": [
        "학력 조건이 없고, 필기부터 순서대로 공부하면 돼요.",
        "자격 하나를 따면 같은 종목의 다른 자격은 시험 일부를 면제받아요."
      ],
      "cons": [
        "만 18세 전에는 자격을 딸 수 없어요.",
        "어린아이를 다루는 일이라 안전과 인내가 많이 필요해요.",
        "필기 과목이 5개라 혼자 공부할 시간을 꾸준히 내야 해요."
      ]
    },
    {
      "id": "sports-college-path",
      "title": "검정고시 보고 대학 체육학과로",
      "learn_style": "school",
      "summary": "학력을 인정받고 대학이나 전문대 체육 관련 학과에서 친구들과 배운 뒤, 건강운동관리사를 따서 운동을 지도해요.",
      "steps": [
        {
          "step": "ged-high",
          "note": "고등학교에 다니고 있다면 이 역은 건너뛰어요."
        },
        {
          "step": "sports-pe-college"
        },
        {
          "step": "sports-health-trainer-exam",
          "note": "체육 분야를 전공하고 졸업(예정)해야 볼 수 있어요."
        },
        {
          "step": "sports-coach-work"
        }
      ],
      "pros": [
        "운동과 몸의 원리를 넓고 깊게 배워요.",
        "건강운동관리사는 체육 전공자만 볼 수 있는 자격이에요. 의사 의뢰를 받아 운동을 지도하는 일도 할 수 있어요."
      ],
      "cons": [
        "검정고시와 입시를 거쳐서 시간이 오래 걸려요.",
        "학비가 들고, 건강운동관리사 응시료와 연수비도 47만 원쯤 들어요.",
        "건강운동관리사는 연수만 200시간 이상이라 준비가 길어요."
      ]
    },
    {
      "id": "sports-athlete-path",
      "title": "선수로 뛰어 보기 (좁은 길)",
      "learn_style": "hands",
      "summary": "클럽이나 팀에서 선수로 훈련하고 대회에 나가요. 선수를 계속하기 어려워져도 지도자 자격으로 운동 일을 이어 갈 수 있어요.",
      "steps": [
        {
          "step": "sports-mission-teach-one"
        },
        {
          "step": "sports-athlete-club"
        },
        {
          "step": "sports-life-coach-exam",
          "note": "선수를 그만둬도 이 자격으로 가르칠 수 있어요."
        },
        {
          "step": "sports-coach-work"
        }
      ],
      "pros": [
        "좋아하는 운동을 가장 깊게 해 볼 수 있어요.",
        "대회에 나간 경력이 4년 이상 쌓이면 2급 전문스포츠지도사 시험을 볼 수 있어요."
      ],
      "cons": [
        "프로팀이나 실업팀에 들어가기는 쉽지 않아요. 다른 길도 함께 준비해요.",
        "다치면 오래 쉬어야 할 수 있고, 훈련비·장비비·대회 참가비가 들 수 있어요.",
        "학교 운동부에 있지 않다면 받아 줄 클럽이나 팀을 직접 찾아야 해요."
      ]
    }
  ]
}
