{
  "id": "care",
  "title": "돌봄·복지",
  "holland": [
    "S",
    "E"
  ],
  "summary": "아이, 어르신, 청소년처럼 도움이 필요한 사람 곁에서 일해요. 봉사로 바로 해 볼 수 있지만, 대표 자격인 사회복지사는 대학이나 학점은행제 학위가 있어야 해서 대학 없이 가는 길은 짧지 않아요.",
  "try_phrase": "누군가 돌봐 주는 일",
  "paths": [
    {
      "id": "care-caregiver-path",
      "title": "봉사로 시작해서 요양보호사로",
      "learn_style": "institution",
      "summary": "봉사로 돌봄 일을 먼저 해 보고, 교육기관에서 요양보호사 교육을 받아 시험을 본 뒤 어르신 돌봄 현장에서 일해요.",
      "steps": [
        {
          "step": "care-mission-find-volunteer"
        },
        {
          "step": "care-volunteer",
          "note": "어르신 돌봄 봉사를 해 보면 이 길이 맞는지 알기 쉬워요."
        },
        {
          "step": "care-caregiver-license"
        },
        {
          "step": "care-welfare-job",
          "note": "주로 요양시설이나 집으로 찾아가는 돌봄 기관에서 일해요."
        }
      ],
      "pros": [
        "학위 없이 준비할 수 있는 국가자격이에요.",
        "교육 기간이 정해져 있어서 끝이 보여요."
      ],
      "cons": [
        "돌보는 대상이 주로 어르신이에요. 아이나 청소년을 돌보고 싶다면 다른 길이 맞아요.",
        "몸을 많이 쓰는 일이에요.",
        "교육비가 들어요. 2025년 보건복지부 지침에서는 처음 배우는 사람이 70만~100만 원 범위였어요.",
        "자격증에는 나이 제한이 없지만, 일할 곳에서 나이 조건을 두기도 해요.",
        "나중에 사회복지사가 되려면 학위를 따로 준비해야 해요."
      ]
    },
    {
      "id": "care-youth-leader-path",
      "title": "청소년 기관에서 일하며 청소년지도사로",
      "learn_style": "hands",
      "summary": "봉사로 청소년 시설을 겪어 보고, 검정고시로 학력을 갖춘 뒤 청소년 기관에서 일하며 경력을 쌓아 청소년지도사 시험을 봐요.",
      "steps": [
        {
          "step": "care-volunteer",
          "note": "청소년수련관이나 방과후아카데미 봉사를 찾아봐요."
        },
        {
          "step": "ged-high"
        },
        {
          "step": "care-welfare-job",
          "note": "청소년수련시설, 방과후아카데미, 학교밖청소년지원센터처럼 경력으로 인정되는 곳인지 미리 확인해요."
        },
        {
          "step": "care-youth-leader",
          "note": "고등학교 졸업 학력만 있으면 3급은 3년 이상 일한 경력이 있어야 응시할 수 있어요."
        }
      ],
      "pros": [
        "대학에 가지 않아도 경력으로 응시할 수 있는 길이 있어요.",
        "일하면서 돈을 벌고 현장을 바로 봐요."
      ],
      "cons": [
        "고졸 학력으로는 3급도 3년 이상 경력이 쌓여야 응시할 수 있어서 오래 걸려요.",
        "자격 없이 청소년 기관에 채용되는 자리는 많지 않을 수 있어요.",
        "경력으로 인정되는 건 정해진 청소년 기관에서 일한 기간이에요. 봉사 시간은 인정 목록에 없어요."
      ]
    },
    {
      "id": "care-credit-bank-path",
      "title": "검정고시 보고 학점은행제로 사회복지사",
      "learn_style": "study",
      "summary": "고졸 학력을 갖춘 뒤 대학에 다니지 않고 학점은행제로 학위와 사회복지 과목을 채워 사회복지사 2급을 받아요.",
      "steps": [
        {
          "step": "ged-high"
        },
        {
          "step": "care-credit-bank",
          "note": "학위를 받으려면 고졸 학력이 있어야 해요. 학습자 등록 때 최종학력증명서를 내요."
        },
        {
          "step": "care-social-worker-2"
        },
        {
          "step": "care-welfare-job",
          "note": "복지관, 지역아동센터 같은 곳에서 사회복지사로 일해요."
        }
      ],
      "pros": [
        "대학에 다니지 않고도 사회복지사 2급을 준비할 수 있어요.",
        "평가인정을 받은 원격(온라인) 수업도 학점으로 인정돼서 일하면서 들을 수도 있어요."
      ],
      "cons": [
        "학위를 채워야 해서 여러 학기가 걸려요.",
        "수업마다 비용이 들어요.",
        "사회복지 현장실습은 보건복지부가 정한 기관에서 160시간 이상 해야 해서, 온라인 수업만으로는 끝나지 않아요."
      ]
    },
    {
      "id": "care-college-path",
      "title": "대학 사회복지·아동·청소년 학과로",
      "learn_style": "school",
      "summary": "대학의 관련 학과에서 친구들과 함께 배우고, 졸업하며 사회복지사·보육교사 같은 자격을 받아 현장으로 가요.",
      "steps": [
        {
          "step": "ged-high",
          "note": "학교를 그만뒀다면 먼저 고졸 학력을 갖춰요."
        },
        {
          "step": "care-welfare-college"
        },
        {
          "step": "care-social-worker-2",
          "note": "학과와 이수 과목에 따라 보육교사 2급이나 청소년지도사를 준비하기도 해요."
        },
        {
          "step": "care-welfare-job"
        }
      ],
      "pros": [
        "한 번에 여러 자격을 준비할 수 있어요.",
        "실습과 동기, 교수님을 통해 현장을 알게 돼요."
      ],
      "cons": [
        "입학 준비와 등록금이 필요해요.",
        "졸업까지 최소 몇 년이 걸려요."
      ]
    }
  ]
}
