{
  "id": "science-lab",
  "title": "과학·실험",
  "holland": [
    "I",
    "R"
  ],
  "summary": "왜 그런지 궁금한 걸 직접 실험해서 확인하는 일이에요. 화학·바이오 회사에서 제품을 분석하고 품질을 살피는 일부터, 대학원을 거쳐 연구소에서 연구하는 일까지 있어요. 연구원은 대학원을 나온 사람이 많지만, 기능사 자격으로 대학 없이 시작하는 길도 있어요.",
  "try_phrase": "과학 실험",
  "paths": [
    {
      "id": "science-lab-exam-path",
      "title": "기능사 따고 회사 생산·품질 일로",
      "learn_style": "hands",
      "summary": "집에서 실험을 해 보고, 고졸 학력과 화학분석기능사·환경기능사를 따서 화학·바이오 회사의 생산·품질 일이나 환경 측정·실험실 일을 시작해요.",
      "steps": [
        {
          "step": "science-lab-mission-kitchen"
        },
        {
          "step": "ged-high",
          "note": "기능사는 학력 없이도 볼 수 있어서 순서를 바꿔도 돼요. 회사에 들어갈 때 고졸 학력이 필요한 경우가 있어요."
        },
        {
          "step": "science-lab-analysis-exam",
          "note": "실기 장비를 써 볼 곳이 있는지 먼저 알아봐요."
        },
        {
          "step": "science-lab-industry-job"
        }
      ],
      "pros": [
        "대학에 가지 않아도 시작할 수 있어요.",
        "일하면서 경력을 쌓으면 산업기사·기사 시험도 볼 수 있어요."
      ],
      "cons": [
        "실기 시험은 분광광도계 같은 실험 장비로 봐서 혼자 연습할 곳을 찾기 어려워요.",
        "화학분석기능사 훈련 과정은 특성화고 안에서 하는 과정평가형 과정만 찾았고, 고용24에서는 찾지 못했어요(2026-09-27).",
        "연구·분석 일은 대학을 나온 사람이 많아요. 채용 공고에서는 기능사보다 산업기사·기사나 관련 학과를 더 우대하기도 해요.",
        "만 18세 미만은 일할 수 있는 시간과 업무에 제한이 있어요."
      ]
    },
    {
      "id": "science-lab-hs-path",
      "title": "특성화고·마이스터고에서 실험 배우기",
      "learn_style": "school",
      "summary": "화학·바이오·환경 관련 학과가 있는 특성화고나 마이스터고에서 친구들과 실습하고, 기능사를 따서 일을 시작해요.",
      "steps": [
        {
          "step": "science-lab-vocational-hs"
        },
        {
          "step": "science-lab-analysis-exam",
          "note": "학교 실험실에서 실기를 연습할 수 있어요."
        },
        {
          "step": "science-lab-industry-job"
        }
      ],
      "pros": [
        "학교 실험실에서 장비를 써 보며 배워요.",
        "졸업하면 고졸 학력과 자격을 함께 갖출 수 있어요."
      ],
      "cons": [
        "학교를 그만뒀다면 다시 들어갈 수 있는지부터 확인해야 해요.",
        "관련 학과가 있는 학교가 지역마다 달라서 멀 수 있어요."
      ]
    },
    {
      "id": "science-lab-college-path",
      "title": "전문대·대학 이공계 나와 분석·품질 일로",
      "learn_style": "study",
      "summary": "학력을 인정받고 전문대나 대학에서 화학·생명·환경을 배운 뒤, 분석·품질 일을 시작해요.",
      "steps": [
        {
          "step": "ged-high"
        },
        {
          "step": "science-lab-college"
        },
        {
          "step": "science-lab-industry-job",
          "note": "관련 학과를 졸업하면 산업기사나 기사 시험을 바로 볼 수 있어요."
        }
      ],
      "pros": [
        "이론과 실험을 넓게 배워요.",
        "관련 학과를 졸업하면 산업기사(전문대)나 기사(대학) 시험을 볼 수 있어요."
      ],
      "cons": [
        "검정고시와 입시를 거쳐서 시간이 오래 걸려요.",
        "학비가 들어요."
      ]
    },
    {
      "id": "science-lab-research-path",
      "title": "대학원까지 가서 연구원으로",
      "learn_style": "study",
      "summary": "실험과 과학관 체험으로 좋아하는지 확인하고, 대학과 대학원을 거쳐 연구소에서 연구하는 사람이 돼요.",
      "steps": [
        {
          "step": "science-lab-mission-kitchen"
        },
        {
          "step": "science-lab-museum"
        },
        {
          "step": "ged-high"
        },
        {
          "step": "science-lab-college",
          "note": "4년제 대학의 화학·생명과학 같은 학과로 가요."
        },
        {
          "step": "science-lab-researcher"
        }
      ],
      "pros": [
        "새로운 것을 직접 밝혀내는 일을 해요.",
        "연구소, 제약·식품 회사 등 갈 수 있는 곳이 넓어요."
      ],
      "cons": [
        "석사·박사까지 가는 경우가 많아서 아주 오래 걸려요.",
        "대학원까지 학비와 생활비 부담이 클 수 있어요.",
        "검정고시와 대학 입시를 먼저 거쳐야 해요."
      ]
    }
  ]
}
